id,sentence,subject_entity,object_entity,label
742,"금붕어는 세계에서 가장 많은 품종이 사육되고 있으며 작은 어항에서 사육하면 수명은 10년, 몸길이는 5cm까지 자란다.","{'start': 0, 'end': 2, 'text': '금붕어', 'type': 'anm'}","{'start': 10, 'end': 17, 'text': '가장 많은 품종', 'type': 'poh'}",no_relation
743,금붕어가 먼저 준 먹이를 다 먹었는지 확인한 뒤에 다음 먹이를 준다.,"{'start': 0, 'end': 2, 'text': '금붕어', 'type': 'anm'}","{'start': 10, 'end': 11, 'text': '먹이', 'type': 'poh'}",anm:enemy
744,"태국과 인도네시아 등 동남아시아에서는 경제가 성장하며 관상어 사육이 늘어났고, 열대 기후를 살려 중화인민공화국이나 일본에는 없는 새로운 품종을 만들어 주로 일본 등지로 수출하고 있다.","{'start': 30, 'end': 32, 'text': '관상어', 'type': 'anm'}","{'start': 21, 'end': 22, 'text': '경제', 'type': 'poh'}",no_relation
745,많은 나라에서 사육제와 전시회 등지에서 금붕어를 비닐봉투에 담아 경품으로 주기도 한다,"{'start': 22, 'end': 24, 'text': '금붕어', 'type': 'anm'}","{'start': 27, 'end': 30, 'text': '비닐봉투', 'type': 'poh'}",no_relation
746,"또한 모든 금붕어들은 약 13cm 정도로 자랄 수 있고, 30cm가 넘게 자라는 종도 있다.","{'start': 6, 'end': 8, 'text': '금붕어', 'type': 'anm'}","{'start': 14, 'end': 17, 'text': '13cm', 'type': 'noh'}",anm:physical
747,그러다가 봄이 되면 금붕어는 다시 활동을 시작하면서 산란도 한다.,"{'start': 11, 'end': 13, 'text': '금붕어', 'type': 'anm'}","{'start': 29, 'end': 30, 'text': '산란', 'type': 'poh'}",anm:habit
748,금붕어(학명: Carassius auratus)는 잉어목 잉어과에 속하는 담수어로 관상용 붕어이다.,"{'start': 32, 'end': 34, 'text': '잉어과', 'type': 'org'}","{'start': 0, 'end': 2, 'text': '금붕어', 'type': 'anm'}",org:sub_group
749,새끼금붕어는 검은빛을 띠다가 성장함에 따라 어미와 똑같은 빛깔과 무늬가 나타나기 시작한다.,"{'start': 2, 'end': 4, 'text': '금붕어', 'type': 'anm'}","{'start': 7, 'end': 9, 'text': '검은빛', 'type': 'poh'}",anm:physical
750,어항에 뾰족한 돌이나 장난감 다리·탑 등을 넣으면 금붕어가 상처를 입기 쉬우므로 넣지 않는 것이 좋다.,"{'start': 28, 'end': 30, 'text': '금붕어', 'type': 'anm'}","{'start': 33, 'end': 34, 'text': '상처', 'type': 'poh'}",no_relation
751,1850년 즈음에는 북아메리카에도 금붕어가 전래돼 미국에서 빠르게 인기를 얻었다.,"{'start': 19, 'end': 21, 'text': '금붕어', 'type': 'anm'}","{'start': 11, 'end': 15, 'text': '북아메리카', 'type': 'loc'}",anm:origin
752,금붕어는 이 동안에는 먹이도 먹지 않는다.,"{'start': 0, 'end': 2, 'text': '금붕어', 'type': 'anm'}","{'start': 12, 'end': 13, 'text': '먹이', 'type': 'poh'}",no_relation
753,금붕어에게 지렁이는 병균을 옮길 수 있으므로 가능하면 주지 않도록 한다.,"{'start': 0, 'end': 2, 'text': '금붕어', 'type': 'anm'}","{'start': 6, 'end': 8, 'text': '지렁이', 'type': 'anm'}",no_relation
754,물의 깊이는 어항 크기에 따라 달라질 수 있으며 어항의 물이 흐려지거나 더러워져 금붕어가 수면에서 입을 뻐끔거리면 물을 갈아 준다.,"{'start': 45, 'end': 47, 'text': '금붕어', 'type': 'anm'}","{'start': 50, 'end': 51, 'text': '수면', 'type': 'poh'}",no_relation
755,금붕어는 물의 온도가 13°C 이하가 되는 겨울에는 어항이나 연못 바닥에 가만히 움직이지 않고 있다.,"{'start': 0, 'end': 2, 'text': '금붕어', 'type': 'anm'}","{'start': 24, 'end': 25, 'text': '겨울', 'type': 'poh'}",no_relation
756,"품종개량된 금붕어는 몸체와 지느러미, 눈 모양이 다르기도 하며 몇몇 종은 수족관에서만 살 수 있고 야생에 가까운 원종(原種) 및 그와 비슷한 종보다 생명력이 떨어지기도 한다.","{'start': 6, 'end': 8, 'text': '금붕어', 'type': 'anm'}","{'start': 55, 'end': 56, 'text': '야생', 'type': 'poh'}",no_relation
757,오늘날 중화인민공화국에서는 300여 종을 인정하고 있으며 대부분의 금붕어들은 중국이 원산지이다.,"{'start': 37, 'end': 39, 'text': '금붕어', 'type': 'anm'}","{'start': 43, 'end': 44, 'text': '중국', 'type': 'loc'}",anm:origin
758,금붕어 어항의 물이 더러워지지 않도록 다 먹지 못한 먹이는 스포이트로 빨아 낸다.,"{'start': 0, 'end': 2, 'text': '금붕어', 'type': 'anm'}","{'start': 29, 'end': 30, 'text': '먹이', 'type': 'no_relation'}",no_relation
759,노르웨이 숲 고양이는 여름과 겨울에 털의 밀도에 차이가 있으며 특히 겨울에는 목 부분에 길고 화려한 털이 촘촘하게 나며 귀 안쪽에 바람과 눈을 막아주는 역할을 하는 긴 털이 나 귀 주변과 바깥쪽으로 휘어 나온다.,"{'start': 0, 'end': 9, 'text': '노르웨이 숲 고양이', 'type': 'anm'}","{'start': 92, 'end': 94, 'text': '긴 털', 'type': 'poh'}",anm:physical
760,Skogkatt이라고 불리는 노르웨이 숲 고양이는 바이킹의 전설과 신화에 등장한다.,"{'start': 16, 'end': 25, 'text': '노르웨이 숲 고양이', 'type': 'anm'}","{'start': 0, 'end': 7, 'text': 'Skogkatt', 'type': 'poh'}",anm:alternate_name
761,노르웨이 숲 고양이는 가족들과 함께 있는 것을 즐기고 놀기를 좋아하는 대화형 고양이이다.,"{'start': 0, 'end': 9, 'text': '노르웨이 숲 고양이', 'type': 'anm'}","{'start': 39, 'end': 45, 'text': '대화형 고양이', 'type': 'poh'}",anm:habit
762,노르웨이 숲 고양이는 단단하고 늘씬한 체형이며 암컷은 수컷에 비하여 크기가 작은 편이다.,"{'start': 0, 'end': 9, 'text': '노르웨이 숲 고양이', 'type': 'anm'}","{'start': 17, 'end': 22, 'text': '늘씬한 체형', 'type': 'poh'}",anm:physical
763,노르웨이 숲 고양이는 자연발생종으로 시작하여 품종개량 과정들을 거쳐 오늘에 이르렀다.,"{'start': 0, 'end': 9, 'text': '노르웨이 숲 고양이', 'type': 'anm'}","{'start': 12, 'end': 16, 'text': '자연발생종', 'type': 'poh'}",anm:origin
764,노르웨이 숲 고양이의 강하고 튼튼한 몸과 두꺼운 코트는 스칸디나비아에서 수세기에 걸쳐 발전해 왔다는 증거이다.,"{'start': 0, 'end': 9, 'text': '노르웨이 숲 고양이', 'type': 'anm'}","{'start': 23, 'end': 28, 'text': '두꺼운 코트', 'type': 'poh'}",anm:physical
765,"노르웨이 숲 고양이는 1977년에 FIFe에서, 1984년에 TICA에서, 1987년에 CFA에서 각각 순종 고양이로 인정받았다.","{'start': 0, 'end': 9, 'text': '노르웨이 숲 고양이', 'type': 'anm'}","{'start': 58, 'end': 59, 'text': '순종', 'type': 'poh'}",anm:habit
766,노르웨이 숲 고양이들은 바이킹과 함께 여행하며 그들의 배와 마을이 해를 입지 않게 했다.,"{'start': 0, 'end': 9, 'text': '노르웨이 숲 고양이', 'type': 'anm'}","{'start': 13, 'end': 15, 'text': '바이킹', 'type': 'poh'}",no_relation
767,노르웨이 숲 고양이는 아몬드형의 눈은 끝부분이 비스듬하게 올라가 있으며 귀 끝쪽에 약간 긴 털이 나 있는 경우도 있다.,"{'start': 0, 'end': 9, 'text': '노르웨이 숲 고양이', 'type': 'anm'}","{'start': 12, 'end': 18, 'text': '아몬드형의 눈', 'type': 'poh'}",anm:physical
768,지능적이고 지략이 뛰어난 노르웨이 숲 고양이는 새로운 환경에 쉽게 적응할 수 있는 온화한 품종이다.,"{'start': 14, 'end': 23, 'text': '노르웨이 숲 고양이', 'type': 'anm'}","{'start': 0, 'end': 2, 'text': '지능적', 'type': 'poh'}",anm:habit
769,노르웨이 숲 고양이는 노르웨이가 원산지인 고양이로 추운 환경에 잘 적응한 품종이다.,"{'start': 0, 'end': 9, 'text': '노르웨이 숲 고양이', 'type': 'anm'}","{'start': 12, 'end': 15, 'text': '노르웨이', 'type': 'loc'}",anm:origin
770,노르웨이 숲 고양이는 한국에서 산책냥이로 알려졌다.,"{'start': 0, 'end': 9, 'text': '노르웨이 숲 고양이', 'type': 'anm'}","{'start': 17, 'end': 20, 'text': '산책냥이', 'type': 'poh'}",anm:alternate_name
771,"노르웨이 숲 고양이는 엄연히 품종개량을 거친 품종묘이므로, 노르웨이에 있는 일반 고양이들과는 다르다.","{'start': 0, 'end': 9, 'text': '노르웨이 숲 고양이', 'type': 'anm'}","{'start': 33, 'end': 36, 'text': '노르웨이', 'type': 'loc'}",no_relation
772,그리하여 1930년대에 노르웨이 숲 고양이의 미래를 보장하기 위한 계획이 시작되었지만 2차 세계 대전으로 인하여 중단되었다.,"{'start': 13, 'end': 22, 'text': '노르웨이 숲 고양이', 'type': 'anm'}","{'start': 48, 'end': 55, 'text': '2차 세계 대전', 'type': 'poh'}",anm:origin
773,노르웨이 숲 고양이는 고양이의 한 품종이다.,"{'start': 12, 'end': 14, 'text': '고양이', 'type': 'org'}","{'start': 0, 'end': 9, 'text': '노르웨이 숲 고양이', 'type': 'org'}",org:sub_group
774,"노르웨이 숲 고양이는 긴 털이 몸 전체를 덮고있고, 겨울에는 특히 추위를 막을 수 있도록 털이 더 촘촘하게 난다.","{'start': 0, 'end': 9, 'text': '노르웨이 숲 고양이', 'type': 'anm'}","{'start': 12, 'end': 14, 'text': '긴 털', 'type': 'poh'}",anm:physical
775,어두운 색의 노르웨이숲고양이는 털의 양이 약간 적은 편이다.,"{'start': 7, 'end': 14, 'text': '노르웨이숲고양이', 'type': 'anm'}","{'start': 0, 'end': 4, 'text': '어두운 색', 'type': 'poh'}",anm:physical
776,노르웨이 숲 고양이의 털의 색은 매우 다양하며 흰색부터 검은색까지 거의 모든 색을 가지며 무늬가 있는 것도 있고 몸의 끝 부분에만 색이 다른 것도 있다.,"{'start': 0, 'end': 9, 'text': '노르웨이 숲 고양이', 'type': 'anm'}","{'start': 12, 'end': 12, 'text': '털', 'type': 'poh'}",anm:physical
777,노르웨이 숲 고양이들은 다소 긴 털이 몸 전체를 덮고 있으며 속 털이 빽빽하고 겉 털이 풍성하다.,"{'start': 0, 'end': 9, 'text': '노르웨이 숲 고양이', 'type': 'anm'}","{'start': 16, 'end': 18, 'text': '긴 털', 'type': 'poh'}",anm:physical
778,"드디어 1970년대에 노르웨이인들은 품종을 보호하기 위해 특별한 육종 프로그램을 시행했으며 후에, 올라프 왕이 노르웨이 숲 고양이를 노르웨이의 공식 고양이라고 지명했을 때 품종은 왕실 인정을 받았다.","{'start': 62, 'end': 71, 'text': '노르웨이 숲 고양이', 'type': 'anm'}","{'start': 55, 'end': 59, 'text': '올라프 왕', 'type': 'per'}",anm:origin
779,닥스훈트는 성격이 밝고 명랑하며 지칠줄 모르는 근성이 있어 쉬지않고 놀아주길 바란다.,"{'start': 0, 'end': 3, 'text': '닥스훈트', 'type': 'anm'}","{'start': 13, 'end': 14, 'text': '명랑', 'type': 'poh'}",anm:habit
780,닥스훈트의 경우 다리가 짧아 살이찔 경우 배가 땅에 닿을 수도 있기 때문에 적절한 운동과 식단조절로 비대해지지 않도록 조절해주는 것이 좋다.,"{'start': 0, 'end': 3, 'text': '닥스훈트', 'type': 'anm'}","{'start': 50, 'end': 53, 'text': '식단조절', 'type': 'poh'}",no_relation
781,"연골발육부전증은 팔, 다리의 정상적 성장은 방해하나, 허리의 성장에는 영향을 주지 않기 때문에 닥스훈트 특유의 외관형성의 중요 요인으로 알려져있다.","{'start': 53, 'end': 56, 'text': '닥스훈트', 'type': 'anm'}","{'start': 0, 'end': 6, 'text': '연골발육부전증', 'type': 'poh'}",anm:physical
782,"닥스훈트는 어깨높이가 21~27cm, 몸무게가 7~15kg이다.","{'start': 0, 'end': 3, 'text': '닥스훈트', 'type': 'anm'}","{'start': 28, 'end': 31, 'text': '15kg', 'type': 'noh'}",anm:physical
783,"닥스훈트는 대담하고 영리하며, 명랑하다.","{'start': 0, 'end': 3, 'text': '닥스훈트', 'type': 'anm'}","{'start': 17, 'end': 18, 'text': '명랑', 'type': 'poh'}",anm:habit
784,닥스훈트는 또한 디스크도 자주 걸릴 수 있다.,"{'start': 0, 'end': 3, 'text': '닥스훈트', 'type': 'anm'}","{'start': 9, 'end': 11, 'text': '디스크', 'type': 'poh'}",anm:physical
785,"닥스훈트는 단모종·강모종·장모종 등이 있으며, 성질은 영리하고 끈기가 있어서 애완용 개로 기르고 있다.","{'start': 0, 'end': 3, 'text': '닥스훈트', 'type': 'anm'}","{'start': 43, 'end': 45, 'text': '애완용', 'type': 'poh'}",anm:role
786,"AKC에 따르면, 닥스훈트는 미국의 개 품종들 사이에서 13위로 인기가 있다고 한다.","{'start': 10, 'end': 13, 'text': '닥스훈트', 'type': 'anm'}","{'start': 0, 'end': 2, 'text': 'AKC', 'type': 'org'}",no_relation
787,"닥스훈트는 선천적으로 심장판막질환 발생 확률이 높으며, 나이 들면 내분비질환인 당뇨병과 쿠싱증후군 발병가능성도 높아진다.","{'start': 0, 'end': 3, 'text': '닥스훈트', 'type': 'anm'}","{'start': 12, 'end': 17, 'text': '심장판막질환', 'type': 'poh'}",anm:physical
788,"닥스훈트는 정열적이며, 참을성이 강하고 뛰어난 후각으로 민첩하게 수렵활동을 한다.","{'start': 0, 'end': 3, 'text': '닥스훈트', 'type': 'anm'}","{'start': 6, 'end': 8, 'text': '정열적', 'type': 'poh'}",anm:habit
789,"닥스훈트가 주로 걸리는 질병으로는 폐암, 비만, 외이염, 백내장, 척추디스크, 갑상선 기능저하증, 동맥관 개존증, 대장암, 방광암, 심장마비 등이 있다.","{'start': 0, 'end': 3, 'text': '닥스훈트', 'type': 'anm'}","{'start': 19, 'end': 20, 'text': '폐암', 'type': 'poh'}",anm:physical
790,닥스훈트는 이집트로부터 건너온 오래된 개의 품종으로 보인다.,"{'start': 0, 'end': 3, 'text': '닥스훈트', 'type': 'anm'}","{'start': 6, 'end': 8, 'text': '이집트', 'type': 'loc'}",anm:origin
791,"닥스훈트가 사지가 짧고, 허리가 긴 이유는 종 전체가 연골발육부전증(Achondrodysplasia)이라는 유전병을 가지고 있기 때문이다.","{'start': 0, 'end': 3, 'text': '닥스훈트', 'type': 'anm'}","{'start': 30, 'end': 36, 'text': '연골발육부전증', 'type': 'poh'}",anm:physical
792,닥스훈트는 천성이 우호적이며 침착하고 신경질적이거나 공격적이지 않다.,"{'start': 0, 'end': 3, 'text': '닥스훈트', 'type': 'anm'}","{'start': 10, 'end': 12, 'text': '우호적', 'type': 'poh'}",anm:habit
793,"닥스훈트는 몸통이 길고 사지가 짧은 독일 원산의 개로서, 원래는 오소리 사냥의 전문개였다.","{'start': 0, 'end': 3, 'text': '닥스훈트', 'type': 'anm'}","{'start': 40, 'end': 41, 'text': '사냥', 'type': 'poh'}",anm:role
794,맹크스는 길가에서도 존재하며 길가에 있는 맹크스는 대부분 꼬리가 검은색이다.,"{'start': 0, 'end': 2, 'text': '맹크스', 'type': 'anm'}","{'start': 32, 'end': 38, 'text': '꼬리가 검은색', 'type': 'poh'}",anm:physical
795,맹크스의 장모종인 씸릭도 존재한다.,"{'start': 0, 'end': 2, 'text': '맹크스', 'type': 'anm'}","{'start': 5, 'end': 6, 'text': '장모', 'type': 'poh'}",anm:physical
796,맹크스는 뒷다리가 앞다리보다 길어서 걸을 때 엉덩이를 흔들며 깡총 뛰는 듯한 걸음걸이로 걷는다.,"{'start': 0, 'end': 2, 'text': '맹크스', 'type': 'anm'}","{'start': 43, 'end': 46, 'text': '걸음걸이', 'type': 'poh'}",anm:habit
797,특이한 것은 맹크스의 꼬리가 시작되는 부위가 오목하게 들어가 있어 꼬리가 없거나 짧다는 것이다.,"{'start': 7, 'end': 9, 'text': '맹크스', 'type': 'anm'}","{'start': 12, 'end': 13, 'text': '꼬리', 'type': 'poh'}",anm:physical
798,맹크스의 털은 2겹이며 광택이 있고 색깔과 눈빛이 다양하다.,"{'start': 0, 'end': 2, 'text': '맹크스', 'type': 'anm'}","{'start': 5, 'end': 5, 'text': '털', 'type': 'poh'}",anm:physical
799,맹크스(Manx)는 중간 크기의 고양이로 원산지는 명확하지 않으나 맨 섬이 원산지로 알려져 있다.,"{'start': 0, 'end': 2, 'text': '맹크스', 'type': 'anm'}","{'start': 37, 'end': 39, 'text': '맨 섬', 'type': 'loc'}",anm:origin
800,맹크스는 둥글고 큰 눈을 가지고 있고 귀는 넓지만 작다.,"{'start': 0, 'end': 2, 'text': '맹크스', 'type': 'anm'}","{'start': 9, 'end': 11, 'text': '큰 눈', 'type': 'poh'}",anm:physical
801,맹크스의 몸길이는 30cm 안팎이며 꼬리 없는 고양이끼리 교배하면 치명적인 유전자의 결합으로 사산할 수 있다.,"{'start': 0, 'end': 2, 'text': '맹크스', 'type': 'anm'}","{'start': 10, 'end': 13, 'text': '30cm', 'type': 'noh'}",anm:physical
802,모래고양이는 물에서 멀리 떨어진 모래사막이나 암석사막에서 발견된다.,"{'start': 0, 'end': 4, 'text': '모래고양이', 'type': 'anm'}","{'start': 25, 'end': 28, 'text': '암석사막', 'type': 'loc'}",anm:habitat
803,"모래고양이는 고양이과 고양이속에 딸린 동물로, 완전한 사막 지형에 서식하는 유일한 고양이과 동물이다.","{'start': 0, 'end': 4, 'text': '모래고양이', 'type': 'anm'}","{'start': 30, 'end': 34, 'text': '사막 지형', 'type': 'loc'}",anm:habitat
804,"모래고양이는 고양이과 고양이속에 딸린 동물로, 완전한 사막 지형에 서식하는 고양이과 동물이다.","{'start': 12, 'end': 15, 'text': '고양이속', 'type': 'org'}","{'start': 0, 'end': 4, 'text': '모래고양이', 'type': 'anm'}",org:sub_group
805,모래고양이의 발은 두툼하게 털로 덮여 있어 극열과 극한이라는 사막의 극단적인 환경에 적응할 수 있다.,"{'start': 0, 'end': 4, 'text': '모래고양이', 'type': 'anm'}","{'start': 15, 'end': 15, 'text': '털', 'type': 'poh'}",anm:physical
806,모래고양이는 개체수 감소로 인하여 2002년에 IUCN에서 준위협종으로 분류하였다.,"{'start': 33, 'end': 36, 'text': '준위협종', 'type': 'poh'}","{'start': 0, 'end': 4, 'text': '모래고양이', 'type': 'anm'}",anm:habit
807,"모래고양이는 북아프리카, 서남아시아, 중앙아시아 등지에 분리되어 분포한다.","{'start': 0, 'end': 4, 'text': '모래고양이', 'type': 'anm'}","{'start': 14, 'end': 18, 'text': '서남아시아', 'type': 'loc'}",anm:habitat
808,목걸이도마뱀과(Crotaphytidae)는 뱀목에 속하는 도마뱀 과의 하나이다.,"{'start': 24, 'end': 25, 'text': '뱀목', 'type': 'org'}","{'start': 0, 'end': 6, 'text': '목걸이도마뱀과', 'type': 'org'}",org:sub_group
809,목걸이도마뱀과는 곤충과 작은 도마뱀을 주로 먹는 육식성 동물이다.,"{'start': 0, 'end': 5, 'text': '목걸이도마뱀', 'type': 'anm'}","{'start': 16, 'end': 18, 'text': '도마뱀', 'type': 'anm'}",anm:enemy
810,목걸이도마뱀과는 미국 남서부와 멕시코 북부 지역의 토착종으로 사막에서 서식하는 파충류이다.,"{'start': 0, 'end': 5, 'text': '목걸이도마뱀', 'type': 'anm'}","{'start': 34, 'end': 35, 'text': '사막', 'type': 'loc'}",anm:habitat
811,목걸이도마뱀과는 동작이 아주 빠른 동물로 네 발과 꼬리가 길다.,"{'start': 0, 'end': 5, 'text': '목걸이도마뱀', 'type': 'anm'}","{'start': 23, 'end': 25, 'text': '네 발', 'type': 'poh'}",anm:physical
812,물총새과는 아프리카 대륙과 오스트레일리아 대륙 그리고 유라시아 대륙에 분포한다,"{'start': 0, 'end': 2, 'text': '물총새', 'type': 'anm'}","{'start': 30, 'end': 36, 'text': '유라시아 대륙', 'type': 'loc'}",anm:habitat
813,나머지 물총새류는 호반새류와 뿔호반새류이다.,"{'start': 10, 'end': 13, 'text': '호반새류', 'type': 'org'}","{'start': 16, 'end': 20, 'text': '뿔호반새류', 'type': 'org'}",no_relation
814,물총새과는 물총새아목 또는 넓은 의미의 물총새류(Kingfishers)에 속하는 3개 분류군 중의 하나이다.,"{'start': 6, 'end': 10, 'text': '물총새아목', 'type': 'org'}","{'start': 0, 'end': 3, 'text': '물총새과', 'type': 'org'}",org:sub_group
815,물총새과(Alcedinidae)는 파랑새목에 속하는 조류 과의 하나이다.,"{'start': 19, 'end': 22, 'text': '파랑새목', 'type': 'org'}","{'start': 0, 'end': 3, 'text': '물총새과', 'type': 'org'}",org:sub_group
816,뱀목의 새로운 분류명 Toxicofera는 다음과 같은 전통적인 분류로 구성되어 있다.,"{'start': 0, 'end': 1, 'text': '뱀목', 'type': 'org'}","{'start': 12, 'end': 21, 'text': 'Toxicofera', 'type': 'poh'}",anm:alternate_name
817,"도마뱀아목(Sauria)이라는 좀 더 최근의 분류명은 일반적으로 파충류와 조류 등에 사용되며, 뱀목(Squamata)은 다르게 나뉜다.","{'start': 0, 'end': 4, 'text': '도마뱀아목', 'type': 'org'}","{'start': 53, 'end': 54, 'text': '뱀목', 'type': 'org'}",no_relation
818,"뱀목 또는 유린목(有鱗目, , scaled reptiles)은 파충강의 한 목이다.","{'start': 35, 'end': 37, 'text': '파충강', 'type': 'org'}","{'start': 6, 'end': 8, 'text': '유린목', 'type': 'org'}",org:sub_group
819,"보더 콜리는 전형적으로 탄탄한 외형에 특출하게 활동적이고 재능이 뛰어나다, 프리스비 등 각종 스포츠에 뛰어나서 늘 우수한 성적으로 독 스포츠 경기와 쉽독 트라이얼을 석권한다.","{'start': 0, 'end': 4, 'text': '보더 콜리', 'type': 'anm'}","{'start': 13, 'end': 18, 'text': '탄탄한 외형', 'type': 'poh'}",anm:physical
820,보더 콜리를 흔히들 가장 똑똑한 개라 말하곤 한다.,"{'start': 0, 'end': 4, 'text': '보더 콜리', 'type': 'anm'}","{'start': 14, 'end': 18, 'text': '똑똑한 개', 'type': 'poh'}",anm:habit
821,보더 콜리는 숱이 많고 속털이 깊은 편으로 엉키지 않도록 빗질을 자주 해주고 털갈이 시기에는 특히 신경을 써야 한다.,"{'start': 0, 'end': 4, 'text': '보더 콜리', 'type': 'anm'}","{'start': 13, 'end': 14, 'text': '속털', 'type': 'poh'}",anm:physical
822,"보더 콜리는 목양견 품종으로 잉글랜드와 스코틀랜드 사이의 국경에서 가축, 특히 양을 몰기 위해 개량되었다.","{'start': 0, 'end': 4, 'text': '보더 콜리', 'type': 'anm'}","{'start': 7, 'end': 9, 'text': '목양견', 'type': 'org'}",anm:role
823,"보더 콜리는 지능과 관련해서 잘 알려져 있는데, 보더 콜리는 1,022개의 명사를 알고 있으며 장난감을 식별할 수 있고 이름 및 카테고리별로 찾을 수 있는 동물로 세계에서 가장 영리한 개로 알려져 있다.","{'start': 0, 'end': 4, 'text': '보더 콜리', 'type': 'anm'}","{'start': 99, 'end': 103, 'text': '영리한 개', 'type': 'poh'}",anm:habit
824,시바견은 일본 고유의 견종이다.,"{'start': 0, 'end': 2, 'text': '시바견', 'type': 'anm'}","{'start': 5, 'end': 13, 'text': '일본 고유의 견종', 'type': 'poh'}",anm:alternate_name
825,시바견은 미국을 비롯해 외국에도 인기가 많다.,"{'start': 0, 'end': 2, 'text': '시바견', 'type': 'anm'}","{'start': 5, 'end': 6, 'text': '미국', 'type': 'loc'}",no_relation
826,천연기념물로 지정된 7견종 중에서 지방 명을 사용하지 않은 것은 시바견뿐이다.,"{'start': 36, 'end': 38, 'text': '시바견', 'type': 'anm'}","{'start': 19, 'end': 20, 'text': '지방', 'type': 'poh'}",no_relation
827,어느 개와 마찬가지로 시바이누는 걷거나 다른 운동을 매일 해야한다.,"{'start': 12, 'end': 15, 'text': '시바이누', 'type': 'anm'}","{'start': 25, 'end': 26, 'text': '운동', 'type': 'poh'}",no_relation
828,시바는 독립적인 본성을 보여주고 가끔 공격적인 성향을 보인다.,"{'start': 0, 'end': 1, 'text': '시바', 'type': 'anm'}","{'start': 4, 'end': 10, 'text': '독립적인 본성', 'type': 'poh'}",anm:habit
829,"시바견의 애호가 중에는 홀쭉한 근육질의 체격이나 경쾌하고 날렵한 움직임, 야성적인 날카로운 경계성, 인간과의 강한 신뢰 관계 같은 조몬 개의 특징을 시바에게 바라는 사람이 많다.","{'start': 0, 'end': 2, 'text': '시바견', 'type': 'anm'}","{'start': 51, 'end': 53, 'text': '경계성', 'type': 'poh'}",no_relation
830,"시바견의 유래에는 여러가지 설이 있어서, 잡목숲을 교묘히 빠져나가서 사냥을 도와서 그렇다는 설, 적갈색의 털빛이 시든 잡목과 비슷해서 그렇다는 설, 작은 것을 나타내는 고어 「시바(柴)」에서 유래했다는 설, 이 세 가지가 대표적이며 그밖에 시나노국의 시바무라(柴村)에서 기원했다는 설이 있다.","{'start': 0, 'end': 2, 'text': '시바견', 'type': 'anm'}","{'start': 140, 'end': 143, 'text': '시바무라', 'type': 'poh'}",anm:origin
831,2년 후까지 시바이누의 골격이 발달되기에 만일 아무것도 발견되지 않았다면 관절 문제로 완전히 자유로워진 것으로 여겨진다.,"{'start': 7, 'end': 10, 'text': '시바이누', 'type': 'anm'}","{'start': 41, 'end': 42, 'text': '관절', 'type': 'poh'}",anm:physical
832,"이것은 암컷 시바들 중에 더 많이 나타나는 현상이고, 그 종의 강력한 맹수욕의 영향을 받는다.","{'start': 7, 'end': 8, 'text': '시바', 'type': 'anm'}","{'start': 39, 'end': 41, 'text': '맹수욕', 'type': 'poh'}",anm:habit
833,"또 시바견은 공식적으로도 ‘시바’(しば, shiba) 또는 ‘시바이누’(しばいぬ, shiba-inu)가 맞는 표현이다.","{'start': 2, 'end': 4, 'text': '시바견', 'type': 'anm'}","{'start': 15, 'end': 16, 'text': '시바', 'type': 'poh'}",anm:alternate_name
